nd_name,school,difficulty,skills,description,full_url,target_student - PD,target_job - PD,cost - ENG,prerequisites - ENG
Data Engineer,School of Data Science,intermediate,"Data Modeling, Data Pipelines, Data Lakes, Spark, Airflow","Data Engineering is the foundation for the new world of Big Data. Enroll now to build production-ready data infrastructure, an essential skill for advancing your data career.Learn More",https://www.udacity.com/course/data-engineer-nanodegree--nd027,,,,
Data Analyst,School of Data Science,intermediate,"Data Wrangling, Matplotlib, Bootstrapping, Pandas & NumPy, Statistics","Use Python, SQL, and statistics to uncover insights, communicate critical findings, and create data-driven solutions.Learn More",https://www.udacity.com/course/data-analyst-nanodegree--nd002,,,,
Programming for Data Science with Python,School of Data Science,beginner,"Python, Numpy & Pandas, SQL, Git & GitHub","Learn the fundamental programming tools for data professionals: Python, SQL, the Terminal and Git.Learn More",https://www.udacity.com/course/programming-for-data-science-nanodegree--nd104,,,,
Data Scientist,School of Data Science,advanced,"Machine Learning, Deep Learning, Software Engineering","Build effective machine learning models, run data pipelines, build recommendation systems, and deploy solutions to the cloud with industry-aligned projects.Learn More",https://www.udacity.com/course/data-scientist-nanodegree--nd025,,,,
Introduction to Programming,School of Programming & Development,beginner,"Introduction to Programming, HTML, CSS, Python","Udacity's Intro to Programming is your first step towards careers in Web and App Development, Machine Learning, Data Science, AI, and more! This program is perfect for beginners.Learn More",https://www.udacity.com/course/intro-to-programming-nanodegree--nd000,,,,
Business Analytics,School of Business,beginner,"Excel & Spreadsheets, SQL, Data Visualization, Data Dashboards","Gain foundational data skills applicable to any industry. Collect and analyze data, model business scenarios, and communicate your findings with SQL, Excel, and Tableau.Learn More",https://www.udacity.com/course/business-analytics-nanodegree--nd098,,,,
Product Manager,School of Business,beginner,"Product Strategy, Product Design, Product Development, Design Sprint, Product Launch","Envision and execute the development of industry-defining products, and learn how to successfully bring them to market.Learn More",https://www.udacity.com/course/product-manager-nanodegree--nd036,,,,
Digital Marketing,School of Business,beginner,"Digital Marketing, Social Media Marketing, Facebook Marketing, Search Engine Optimization, Search Engine Marketing, Display Ads, Search Ads",Gain real-world experience running live campaigns as you learn from top experts in the field. Launch your career with a 360-degree understanding of digital marketing.Learn More,https://www.udacity.com/course/digital-marketing-nanodegree--nd018,,,,
Artificial Intelligence for Trading,School of Artificial Intelligence,intermediate,"Momentum Trading Strategy, Smart Beta, Alpha Factors, Natural Language Processing, Deep Learning, Neural Networks","Complete real-world projects designed by industry experts, covering topics from asset management to trading signal generation. Master AI algorithms for trading, and build your career-ready portfolio.Learn More",https://www.udacity.com/course/ai-for-trading--nd880,,,,
UX Designer,School of Business,beginner,"User Research, User Experience, Prototyping, Interactive Design, User Interface Design, Usability Testing",Design impactful user experiences for products in today’s digital world.Learn More,https://www.udacity.com/course/ux-designer-nanodegree--nd578,,,,
Front End Web Developer,School of Programming & Development,intermediate,"JavaScript, HTML, CSS, Webpack, Flexbox, Node, Object-Oriented Programming",Learn how to build high quality websites and dynamic applications to create stunning user experiences for the web.Learn More,https://www.udacity.com/course/front-end-web-developer-nanodegree--nd0011,,,,
AI Programming with Python,School of Artificial Intelligence,beginner,"Python, NumPy, Pandas, Matplotlib, PyTorch","Learn Python, NumPy, Pandas, Matplotlib, PyTorch, Calculus, and Linear Algebra—the foundations for building your own neural network.Learn More",https://www.udacity.com/course/ai-programming-python-nanodegree--nd089,,,,
Machine Learning Engineer,School of Artificial Intelligence,intermediate,"Machine Learning, Supervised Learning, Unsupervised Learning, Deep Learning","Become a machine learning engineer and apply predictive models to massive data sets in fields like education, finance, healthcare or robotics.Learn More",https://www.udacity.com/course/machine-learning-engineer-nanodegree--nd009t,,,,
Deep Learning,School of Artificial Intelligence,intermediate,"Deep Learning, Neural Networks, Jupyter Notebooks, CNNs, GANs",Deep learning is driving advances in artificial intelligence that are changing our world. Enroll now to build and apply your own deep neural networks to produce amazing solutions to important challenges.Learn More,https://www.udacity.com/course/deep-learning-nanodegree--nd101,,,,
C++,School of Autonomous Systems,intermediate,"Data Structures & Algorithms, Memory Management, Concurrency, Object Oriented Programming, C++",Get hands-on experience by building five real-world projects.Learn More,https://www.udacity.com/course/c-plus-plus-nanodegree--nd213,,,,
Full Stack Web Developer,School of Programming & Development,intermediate,"Python, JavaScript, PostgreSQL, Flask, Docker, Kubernetes","Learn to design and develop powerful modern web applications that form the foundation for the apps, websites, and systems that people and businesses use every day.Learn More",https://www.udacity.com/course/full-stack-web-developer-nanodegree--nd0044,,,,
Self Driving Car Engineer,School of Autonomous Systems,advanced,"Computer Vision, Deep Learning, Sensor Fusion, Localization, Self-Driving Cars","Self-driving cars are set to revolutionize the way we live. This is transformational technology, on the cutting-edge of robotics, machine learning, software engineering, and mechanical engineering. In this program, you’ll learn the skills and techniques used by self-driving car teams at the most advanced technology companies in the world.Learn More",https://www.udacity.com/course/self-driving-car-engineer-nanodegree--nd013,,,,
SQL,School of Data Science,beginner,"SQL, PostgreSQL, JOINs, Subqueries, Window Functions, Partitions, Data Cleaning, DDL, DML, Relational and Non-Relational Databases","Master SQL, the core language for Big Data analysis, and enable insight-driven decision-making and strategy for your business.Learn More",https://www.udacity.com/course/learn-sql--nd072,,,,
Data Structures and Algorithms,School of Programming & Development,intermediate,"Data Structures and Algorithms, Problem Solving, Interview Practice Problems, Python",Get hands-on practice with over 100 data structures and algorithm exercises and technical mentor support when needed to help prepare you for interviews and on-the-job scenarios.Learn More,https://www.udacity.com/course/data-structures-and-algorithms-nanodegree--nd256,,,,
Data Product Manager,School of Business,intermediate,"Data Science, Product Management, Product Design, Data Visualization, User Journey Maps","Hone specialized skills in Data Product Management by learning how to apply data science best practices to build data-driven products backed by scalable data strategies to deliver the right experience to the right users, at the right time.Learn More",https://www.udacity.com/course/data-product-manager-nanodegree--nd030,,,,
Activation and Retention Strategy,School of Business,intermediate,"Product Management, Activation Funnels, Retention Analysis, Churn Analysis, Segment Analysis, User Engagement, Cohort Analysis","Hone specialized Product Management skills in activation and retention strategy. Guide users through the activation funnel as fast as possible, so they reach your product’s aha-moment, and deploy experiments to improve customer lifetime value and decrease churn.Learn More",https://www.udacity.com/course/activation-and-retention-strategy--nd037-2,,,,
Java Developer,School of Programming & Development,intermediate,"Java, Spring Boot, Rest API, MySQL, MongoDB",Learn back-end development with the Java programming languageLearn More,https://www.udacity.com/course/java-developer-nanodegree--nd035,,,,
Deep Reinforcement Learning,School of Artificial Intelligence,advanced,"Reinforcement Learning, Neural Networks, PyTorch, Deep Q-Networks (DQN), Deep Deterministic Policy Gradients (DDPG)",Master the deep reinforcement learning skills that are powering amazing advances in AI. Then start applying these to applications like video games and robotics.Learn More,https://www.udacity.com/course/deep-reinforcement-learning-nanodegree--nd893,,,,
Cloud DevOps Engineer,School of Cloud Computing,intermediate,"AWS, Configuration Management with Ansible, Continuous Integration / Continuous Deployment, Microservices with Kubernetes, CloudFormation","Companies are looking for talented DevOps engineers to remain competitive in this agile world. Enroll now to operationalize infrastructure at scale and deliver applications and services at high velocity, an essential skill for advancing your career.Learn More",https://www.udacity.com/course/cloud-dev-ops-nanodegree--nd9991,,,,
iOS Developer,School of Programming & Development,intermediate,"Swift programming, Core Data, UIKit, iOS networking, app publishing, User interfaces, Local Persistence, APIs","Master the Swift programming language, and create a portfolio of iOS apps for iPhone and iPad to showcase your skills!Learn More",https://www.udacity.com/course/ios-developer-nanodegree--nd003,,,,
Blockchain Developer,School of Programming & Development,intermediate,"Ethereum Blockchain, Blockchain Architecture, Data Auditing","Demand for blockchain developers is skyrocketing. In this program, you'll work with the Bitcoin and Ethereum protocols, build projects for real-world application, and gain the essential skills for a career in this dynamic space.Learn More",https://www.udacity.com/course/blockchain-developer-nanodegree--nd1309,,,,
React,School of Programming & Development,intermediate,"React, Redux, React Native",React is completely transforming Front-End Development. Master this powerful UI library from Facebook with Udacity.Learn More,https://www.udacity.com/course/react-nanodegree--nd019,,,,
Cloud Developer,School of Cloud Computing,intermediate,"AWS, Microservices, Serverless Architecture, Kubernetes","Cloud development is the foundation for the new world of software development. Enroll now to build and deploy production-ready full stack apps at scale on AWS, an essential skill for advancing your web development career.Learn More",https://www.udacity.com/course/cloud-developer-nanodegree--nd9990,,,,
Computer Vision,School of Artificial Intelligence,advanced,"Convolutional Neural Networks (CNN), Recurrent Neural Networks (RNN), Simultaneous Localization and Mapping (SLAM), Object Tracking, Image Classification, Deep Learning","Learn the computer vision skills behind advances in robotics and automation. Write programs to analyze images, implement feature extraction, and recognize objects using deep learning models.Learn More",https://www.udacity.com/course/computer-vision-nanodegree--nd891,,,,
Data Streaming,School of Data Science,advanced,"Data Streaming, Spark, Kafka, Kafka Streaming, Spark Streaming",Learn how to stream data to unlock key insights in real-time.Learn More,https://www.udacity.com/course/data-streaming-nanodegree--nd029,,,,
Intro to Self-Driving Cars,School of Autonomous Systems,intermediate,"Computer Vision, Machine Learning, Vehicle Motion, Control",This introductory program is the perfect way to start your journey.Learn More,https://www.udacity.com/course/intro-to-self-driving-cars--nd113,,,,
Intro to Machine Learning with PyTorch,School of Artificial Intelligence,intermediate,"Introduction to Machine Learning, Supervised Learning, Deep Learning, Unsupervised Learning","Build a solid foundation in Supervised, Unsupervised, and Deep Learning. Then, use these skills to test and deploy machine learning models in a production environment.Learn More",https://www.udacity.com/course/intro-to-machine-learning-nanodegree--nd229,,,,
Sensor Fusion Engineer,School of Autonomous Systems,advanced,"Perception, Lidar, Radar, Sensors, Computer Vision","Learn to fuse lidar point clouds, radar signatures, and camera images using Kalman Filters to perceive the environment and detect and track vehicles and pedestrians over time.Learn More",https://www.udacity.com/course/sensor-fusion-engineer-nanodegree--nd313,,,,
Natural Language Processing,School of Artificial Intelligence,advanced,"Machine Learning, Speech Recognition, Sentiment Analysis, Machine Translation, Part of Speech Tagging","Learn the skills to get computers to understand, process, and respond to human language. Build models on real data, and get hands-on experience with sentiment analysis, machine translation, and more.Learn More",https://www.udacity.com/course/natural-language-processing-nanodegree--nd892,,,,
AI Product Manager,School of Artificial Intelligence,beginner,"AI Products, Training ML Models, Annotating Datasets, Prototyping a Product",Learn to develop AI products that deliver business value. Build skills that help you compete in the new AI-powered world.Learn More,https://www.udacity.com/course/ai-product-manager-nanodegree--nd088,,,,
Artificial Intelligence,School of Artificial Intelligence,advanced,"AI Algorithms, Search Algorithms, Optimization, Planning, Pattern Recognition","Learn essential Artificial Intelligence concepts from AI experts like Peter Norvig and Sebastian Thrun, including search, optimization, planning, pattern recognition, and more.Learn More",https://www.udacity.com/course/ai-artificial-intelligence-nanodegree--nd898,,,,
Agile Software Development,School of Business,beginner,"Agile, Scrum, Kanban, XP, Minimum Viable Product","The Agile Software Development Nanodegree program equips you with the skills you need to guide the delivery of high value products with top notch software development teams.
Learn More",https://www.udacity.com/course/agile-software-development-nanodegree--nd144,,,,
Robotics Software Engineer,School of Autonomous Systems,advanced,"C++, ROS, Localization, Mapping, SLAM, Navigation, Path Planning, Robot Operating System, Robotics","Build five hands-on projects to acquire core robotics software engineering skills: ROS, Gazebo, Localization, Mapping, SLAM, Navigation, and Path Planning.Learn More",https://www.udacity.com/course/robotics-software-engineer--nd209,,,,
AI for Healthcare,School of Artificial Intelligence,advanced,"Artificial Intelligence, 2D Medical Imaging, 3D Medical Imaging, Electronic Health Record Data, Deep Learning, Wearable Device Data, Supervised Learning","Be at the forefront of the revolution of AI in Healthcare, and transform patient outcomes. Enable enhanced medical decision-making powered by machine learning to build the treatments of the future.Learn More",https://www.udacity.com/course/ai-for-healthcare-nanodegree--nd320,,,,
Introduction to Cybersecurity,School of Programming & Development,beginner,"Threat Assessment, Security Vulnerabilities, Compliance, Governance, Risk, Incident Response","Get your start in the high growth field of Cybersecurity by building foundational skills in how to evaluate, maintain, and monitor the security of computer systems.Learn More",https://www.udacity.com/course/intro-to-cybersecurity-nanodegree--nd545,,,,
Predictive Analytics For Business,School of Business,beginner,"Data Wrangling, Classification, A/B Testing, Forecasting, Segmentation","Predictive analytics is the practice of determining patterns from data to predict future outcomes and trends. Across industries, it enables high-value solutions to important business problems.Learn More",https://www.udacity.com/course/predictive-analytics-for-business-nanodegree--nd008,,,,
AWS Cloud Architect,School of Cloud Computing,advanced,"Cloud Infrastructure, Cloud Security, AWS, CloudFormation, High Availability Infrastructure, Serverless Computing","Lead your organization's cloud computing strategy as an AWS Cloud Architect. Plan, design, and build secure, high availability cloud infrastructure.Learn More",https://www.udacity.com/course/aws-cloud-architect-nanodegree--nd063,,,,
Intro to Machine Learning with TensorFlow,School of Artificial Intelligence,intermediate,"TensorFlow, Deep Learning, scikit-learn, Supervised Learning, Unsupervised Learning","Build a solid foundation in Supervised, Unsupervised, and Deep Learning. Then, use these skills to test and deploy machine learning models in a production environment.Learn More",https://www.udacity.com/course/intro-to-machine-learning-with-tensorflow-nanodegree--nd230,,,,
Intermediate JavaScript,School of Programming & Development,intermediate,"Functional Programming, DOM, Data Structures, Asynchronous Programming, Synchronous Programming","Master JavaScript, the most popular programming language in the world. Be equipped for advanced roles in web development, server-side application development, and desktop development.Learn More",https://www.udacity.com/course/intermediate-javascript-nanodegree--nd032,,,,
Marketing Analytics,School of Business,beginner,"Google Analytics, Excel & Spreadsheets, Data Visualization, Customer Segmentation","Gain foundational data skills applicable to marketing. Collect and analyze data, model marketing scenarios, and communicate your findings with Excel, Tableau, Google Analytics, and Data Studios.Learn More",https://www.udacity.com/course/marketing-analytics-nanodegree--nd028,,,,
Data Science for Business Leaders,School of Business,intermediate,"Business Strategy, Data Science, Data Architecture, Machine Learning, Human Capital","Master the people, platforms, and processes required to leverage the power of Data Science in your business.Learn More",https://www.udacity.com/course/data-science-for-business-leaders--nd045,,,,
Flying Car and Autonomous Flight Engineer,School of Autonomous Systems,advanced,"3D Motion Planning, Controls, Estimation, Kalman Filters","Master job-ready autonomous flight software engineering skills as you tackle advanced challenges, write real code for real aircraft, and develop a systems understanding of the Flying Car full-stack.Learn More",https://www.udacity.com/course/flying-car-nanodegree--nd787,,,,
Cloud DevOps using Microsoft Azure,School of Cloud Computing,intermediate,"Infrastructure as Code,  Configuration Management,  Agile Planning,  Continuous Integration,  Continuous Delivery,  Test Automation,  Monitoring","Learn how to deploy, test, and monitor cloud applications on Azure, one of the most popular cloud services platforms used by businesses across the globe.Learn More",https://www.udacity.com/course/cloud-devops-using-microsoft-azure-nanodegree--nd082,,,,
AI for Business Leaders,School of Business,intermediate,"Artificial Intelligence, Machine Learning, Business Strategy, Data Labeling, Data Modeling","Master the foundations of artificial intelligence so you can strategically implement machine learning technology in your organization, and leverage it for corporate growth.Learn More",https://www.udacity.com/course/ai-for-business-leaders--nd054,,,,
Data Visualization,School of Data Science,beginner,"Data Visualization, Tableau, Dashboards, Data Storytelling","Combine data, visuals, and narrative to tell impactful stories and make data-driven decisions.Learn More",https://www.udacity.com/course/data-visualization-nanodegree--nd197,,,,
Android Basics,School of Programming & Development,beginner,"Android Development, Java programming, Android Studio, XML layouts, Android Views",No programming experience? No Problem! Start developing Android apps today.Learn More,https://www.udacity.com/course/android-basics-nanodegree-by-google--nd803,,,,
Programming for Data Science with R,School of Data Science,beginner,"R, SQL, Git","Prepare for a data science career by learning the fundamental data programming tools: R, SQL, command line, and git.Learn More",https://www.udacity.com/course/programming-for-data-science-nanodegree-with-R--nd118,,,,
Growth Product Manager,School of Business,intermediate,"Product Management, Growth Strategy, Customer Acquisition, Activation Strategy, Monetization Strategy, Performance Optimization","Hone specialized Product Management skills in growth strategy. Lead experimentation and data-driven decision-making in your organization to drive products to reach the next level of scale, impact, and profitability.Learn More",https://www.udacity.com/course/growth-product-manager-nanodegree--nd037,,,,
Intel® Edge AI for IoT Developers,School of Artificial Intelligence,advanced,"Edge AI, Computer Vision, Deep Learning, Edge Computing, AI Modeling, Deep Neural Networks (DNN), Convolutional Neural Networks (CNN), IoT, Intel® Distribution of OpenVINO™ Toolkit, Intel® DevCloud for the Edge",Lead the development of cutting-edge Edge AI applications that are the future of the Internet of Things. Leverage the Intel® Distribution of OpenVINO™ Toolkit to fast-track development of high-performance computer vision and deep learning inference applications.Learn More,https://www.udacity.com/course/intel-edge-ai-for-iot-developers-nanodegree--nd131,,,,
Security Engineer,School of Programming & Development,intermediate,"Cryptography, Risk Evaluation, Authentication, Authorization, Access
Management, Penetration Testing",Take advantage of the growing need for skilled security professionals by mastering the sought-after skills to protect an organization’s computer networks and systems from security threats or attacks.Learn More,https://www.udacity.com/course/security-engineer-nanodegree--nd698,,,,
Security Analyst,School of Programming & Development,intermediate,"Security controls,  Defensible Network Architecture,  security threat mitigation,  threat modeling,  vulnerability assessment,  incident detection and handling","The Security Analyst Nanodegree program was designed to help students take advantage of the growing need for skilled information security analysts. Students will learn to identify, correct and respond to security weaknesses and incidents and get hands-on experience monitoring network traffic, analyzing alert and log data, and following incident handling procedures.Learn More",https://www.udacity.com/course/security-analyst-nanodegree--nd324,,,,
Java Programming,School of Programming & Development,beginner,"Object-oriented programming,  functional programming,  I/O,  reflection,  concurrent programming,  Java modules","This Nanodegree program is intended to elevate your Java abilities and teach you the fundamental skills used by Java developers to design, code, test and deploy cutting-edge Java software. It is ideal for programming beginners with little or no Java experience who want to set themselves up for success as a professional Java developer and deploy functional Java-based applications of their own creation.Learn More",https://www.udacity.com/course/java-programming-nanodegree--nd079,,,,
Intermediate Python,School of Programming & Development,intermediate,"Python, Object-oriented programming, Modular code, Python Package Index","The Intermediate Python Nanodegree program teaches intermediate-level skills for programming with the Python language.  It is ideal for developers interested in using Python to build more complex algorithms with greater capabilities in preparation for a variety of different roles spanning fields like data science, AI, and software engineering.Learn More",https://www.udacity.com/course/intermediate-python-nanodegree--nd303,,,,
Android Kotlin Developer,School of Programming & Development,intermediate,"Android Development, Kotlin, Android Studio, Gradle, RESTful interfaces, Web APIs, App Architecture, Databases, Custom Views, Notifications, Location Services, Testing, Firebase","Master Android app development with Kotlin, a modern programming language that enables developers to be more productive.Learn More",https://www.udacity.com/course/android-kotlin-developer-nanodegree--nd940,,,,
RPA Developer with UiPath,School of Programming & Development,beginner,"Process Automation, Business Operations, UiPath Studio, UiPath Orchestator",Build the operational processes that enable the businesses of the future.Learn More,https://www.udacity.com/course/rpa-developer-nanodegree--nd340,,,,
Data Architect,School of Data Science,advanced,"Entity relationship diagrams,  Relational Data Design,  Online Analytical Processing,  Operational Data Stores,  Data Lake Architecture,  Data Governance","Learn how to plan, design and implement enterprise data infrastructure solutions and create the blueprints for your organization’s data success.Learn More",https://www.udacity.com/course/data-architect-nanodegree--nd038,,,,
Hybrid Cloud Engineer,School of Cloud Computing,intermediate,"Hyper-converged infrastructure,  Hybrid Cloud,  Public Cloud,  Private Cloud,  HCI Clusters,  Workload Management,  On premise,  Off premise","This Nanodegree program, built in collaboration with experts from Nutanix, a leader in the cutting edge field of hyperconverged infrastructure software, takes cloud technology and data-center professionals on an in-depth journey into the design, deployment, and management of infrastructure and applications together on the Hybrid Cloud. Master the concepts you need to transform how your IT teams manage applications and support the business.Learn More",https://www.udacity.com/course/hybrid-cloud-engineer-nanodegree--nd321,,,,
